name,ratings,number of ratings,price
"10 inch Tablet Android 8.1, Quad-Core, Google Certified, 16GB, 3G Unlocked Phone Tablet with Dual Sim Card Slots & Cameras, IPS HD Touchscreen, WiFi, Bluetooth, GPS, FM, Netflix, 6000 mAh, Black",3.9 out of 5 stars,51,Price not found
"5G WiFi 2 in 1 Tablet 10 inch Android 10.0 Tablet，4GB RAM 64GB ROM/128GB Expansion Tablet PC with Keyboard Mouse,Quad Core Processor10.1 IPS Touch-Screen,Bluetooth, Google Certification Tablets",3.6 out of 5 stars,10,Price not found
"Tablet 10 Inch, Quad Core Android 9 1280x800HD Touchscreen Tablets with WiFi, 6000mAh Battery, 32GB ROM 128GB Expand Storage, Dual Camera. Bluetooth/GPS/FM/OTG/Google Certified,（Black）",3.4 out of 5 stars,29,Price not found
"Tablet 8 Inch 4G Phone Tablets Dual Sim Card, Octa-core Processor,1920x1200 Full HD Display, Android 10 Tablet, with 3GB RAM 32GB Storage,8MP+5MP Camera, Phablet,WiFi, Bluetooth, GPS (Gray)",0,0,Price not found
"Android 10.0 Tablet,Octa-Core Processor,3GB RAM 32GB Storage,10 inch 1920x1200 HD,5G WiFi Tablets,USB Type C Port,Bluetooth, Blue Light Filter Screen,Black",3.9 out of 5 stars,24,Price not found
RCA 11 Delta Pro 11.6 Inch Quad-Core 2GB RAM 32GB Storage IPS 1366 x 768 Touchscreen WiFi Bluetooth with Detachable Keyboard Android 10 Tablet,4.3 out of 5 stars,113,Price not found
"iProda Android Tablet, 10.1 Inch Tablet with HD IPS Display, Android 9.0, 3GB RAM & 64GB ROM, Google GMS Verified, WiFi, Bluetooth, GPS, Camera, Super Slim Design with Metal Shell & Tablet Case",3.7 out of 5 stars,93,Price not found
"8 inch Android Tablet, Vastking Kingpad SA8 V2.0 Android 10.0, 1920x1200 IPS, Full HD, 3GB RAM, 32GB Storage, 13MP Camera, 5Ghz WiFi, Bluetooth 5.0, GPS, Octa Core, Blue Light Filter, Silver",0,0,Price not found
Tablet for Kids 7inch Kids Tablet for Toddler Tablets with Case Tablets for Kids Premium Kids Tablets 1GB 16GB IPS Safety Eye Protection Screen Parental Controls YouTube Google Tablet Kid Pink,4.1 out of 5 stars,401,Price not found
"AEEZO Kids Tablet 7 inch WiFi Android 10 Tablet PC 2020 New FHD 1920x1200 IPS Screen, 2GB RAM 32GB ROM",4.0 out of 5 stars,670,Price not found
"CHUWI Hipad X Android 10.0 Tablet PC, 10.1 inch Unlocked Phablet 4G LTE with Dual Micro SIM, RAM 4G / ROM 128G, Support GPS, OTG, FM, G-Sensor, Light Sensor, TF Card, BT 5.0, Dual WiFi",4.2 out of 5 stars,89,Price not found
"Android 10 Tablet: Blackview Tablet 10.1 inch 3GB+32GB, 6580mAh Battery, 13MP+5MP Dual Cameras, 1920×1200 FHD IPS Display, Otca Core Processor Android Tablet, WiFi Support-Grey",4.3 out of 5 stars,56,Price not found
YELLYOUTH 10.1 inch Tablet Android 10 with Dual Sim Card Slot Octa Core 4GB RAM 64GB ROM 4G LTE Phone Call with WiFi GPS Bluetooth Camera Silver,3.6 out of 5 stars,13,Price not found
"CARRVAS Tablet for Kids, 7inch WiFi & Android 8.1 KidsTablet 1G(RAM)+16G, Pre-Installed Iwawa, Parenting Control Tablet with Educational Games App",3.0 out of 5 stars,18,Price not found
"Kids Tablet 7 inch, WiFi Android 9.0 Pie Tablet for Kids, 2GB RAM 16GB ROM, Kid Edition Tablets, Parental Control, Education Apps Pre Installed, Dual Camera, 7” HD Display, Kids- Proof Case, Pink",4.1 out of 5 stars,181,Price not found
"[3 Bonus Item] Simbans TangoTab 10 Inch Tablet 4 GB RAM, 64 GB Disk, Android 10, Mini-HDMI, Micro-USB, USB-A, Inbuilt GPS, Dual WiFi, Bluetooth, IPS Screen, Dual Camera Computer PC - TCX",4.0 out of 5 stars,"1,622",Price not found
"YIERA 10 inch Android 8.1 Tablet Unlocked Pad with Dual SIM Card Slot 10.1"" IPS Screen 4GB RAM 64GB ROM 3G Phablet Built-in Bluetooth WiFi GPS Tablets (Metallic Silver)",3.6 out of 5 stars,303,Price not found
"Kids Tablet, 7 inch Android 9.0 Toddler Tablet for Kids Edition Tablet with Parental Control, Kids Software Pre-Installed,WiFi Dual Camera 1GB+16GB, 1024 x 600 IPS Screen, and Kids-Proof Case (Pink)",3.8 out of 5 stars,19,Price not found
"RCA 11.6"" Tablet with Keyboard Folio (Rose Gold)",4.4 out of 5 stars,12,Price not found
"Kids Tablets, Android Tablet for Kids, 16GB ROM, IPS Eye Protection Display, Kids Tablet with WiFi Dual Camera Parental Control Kid-Proof Case and Learning Games, Best Gift for Boys Girls, Pink",3.6 out of 5 stars,626,Price not found
"Vastking Kingpad Z10 10 inch Tablet, Android 11, 2 GB RAM, 32 GB Storage, Quad-Core Processor, 10.1"" IPS 1280x800 Display, USB Type C Port, GPS, FM, 8MP Rear Camera, Slate Black Metal Body",0,0,Price not found
"RCA 11 Delta Pro 11.6 Inch Quad-Core 2GB RAM 32GB Storage IPS 1366 x 768 Touchscreen WiFi Bluetooth with Detachable Keyboard Android 10 Tablet (11.6"", Purple)",4.2 out of 5 stars,102,Price not found
"Haehne 7 inch Tablet, Android 6.0, Quad Core Processor, 1G RAM 16GB Storage, HD Display, Dual Camera, FM, WiFi Only, Bluetooth, Blue",3.2 out of 5 stars,917,Price not found
"10 inch Tablet, Android OS with 3GB RAM 32GB ROM, Octa-core UPC, Support 5G WiFi, 8 MP Dual Camera, 1920X1200 HD Touch Screen for Kids, Teenagers and Elderly, Black (Case and 64GB Extra Sd Card)",5.0 out of 5 stars,7,Price not found
"Ultra Rugged Android Tablet Barcode Scanner, 8-inch / IP67 Fully Waterproof/Integrated Zebra 2D QR Scan Engine/GPS, for Enterprise Data Collection",3.8 out of 5 stars,6,629.99
"JREN Android Tablet 10 inch, 10 inch Tablet with 3GB RAM 32GB ROM Octa-Core Processor, J10 1200x1920 IPS Full HD Display, 6000mAh Battery 5G WiFi USB Type-C GPS FM -Black",4.5 out of 5 stars,26,Price not found
"TJD 7 inch Kids Tablet, Android 10.0 OS Tablet for Kids, Parent Control, iWawa Learning Software, 2GB RAM 16GB ROM, Dual Cameras, Bluetooth, WiFi, Frog Style with Stand Boys Girls Gifts MT-761QU",4.6 out of 5 stars,9,Price not found
"Android 10 Tablet, Facetel Q3 Pro 10 inch Tablets-Octa Core Processor 1.6GHz, 32GB ROM 128GB Expand, HD IPS Screen, Google Certification, Wi-Fi, Bluetooth, GPS, Metal Body - Grey",4.2 out of 5 stars,205,Price not found
"Kids Tablet 7"" Inch IPS HD Display Android 10.0 Tablet PC for Kids GMS Certificated 2GB RAM 16GB ROM WiFi Hand Free Silicon Case Kids Educational APP Google Kids Tablet Red",4.1 out of 5 stars,112,Price not found
"Tablet PC 7 inch,Android Quad Core Tablet Computer with Keyboard,Dual Camera,40GB Storage Capacity,Capacitive Touch Screen,Support WiFi,Bluetooth,GPS(with Stylus) (Pink)",3.3 out of 5 stars,145,Price not found
"Android 10, 8-inch Android Tablet, Vastking Kingpad SA8 Octa-Core Processor, 3GB RAM, 32GB Storage, 1920x1200 IPS, 5G Wi-Fi, GPS, 13MP Camera, Blue Light Filter Screen, Rose Gold",5.0 out of 5 stars,1,Price not found
"Tablet 8 inch, 8"" HD Display,Android 10.0,2GB RAM,32GB Storage, 5100mah,IPS hd Display,Quad-Core Processor, 5MP 8MP Dual Camera,Wi-Fi,Bluetooth,GPS oteeto - Tablet PC (Black)",4.0 out of 5 stars,3,Price not found
"10 Inch Tablet 3GB RAM 32GB ROM, Android 10 WiFi Tablet with Cover Case Stand, 1.6GHz Quad Core, HD Touchscreen, Dual Speakers - Black",4.1 out of 5 stars,50,Price not found
Nvidia Corporation 900-14932-2500-000 Rtx Nv Link Bridge 3 Slot,4.6 out of 5 stars,48,159.54
"Wecool Tablet Android 8.1 Go [GMS Certified], 10 inch Unlocked 3G Phablet,1GB+16GB Storage,Tablet PC with Dual Sim Card Slots, Dual Cameras,OTG, WiFi, Bluetooth,GPS, OTG",3.9 out of 5 stars,330,Price not found
Kids Tablets pc 7 Android Kids Tablet for Kids Learning Tablet Quad Core with WiFi Dual Camera IPS Safety Eye Protection Screen 1GB 16GB Storage,3.8 out of 5 stars,750,Price not found
"Octa-Core Tablet 10.1 Inch, Android 10.0 Tablet, 32GB ROM/128GB Expand, 1920x1200 IPS HD Glass Display, Dual 18MP Camera, WiFi/Bluetooth/GPS/OTG/Google Certified Tablet [2021 Latest Black]",4.1 out of 5 stars,55,Price not found
"Android Tablet 10 inch, HD Touchscreen 2-in-1 Tablet with Keyboard Case Computer Quad-Core 1.3Ghz Processor 4G+64GB Harddrive Android 9.0 GO Tablets, Support 3G Phone Call, Type-C,BT4.2 GPS FM 4G WiFi",4.5 out of 5 stars,45,Price not found
"Tablet 10.1 inch Android Go 8.1 Tablet PC,Google Certified, 1GB RAM, 16GB Storage, WiFi, Bluetooth,GPS, 1280X800 IPS Screen, 3G Phablet with Dual Sim Card Slots,Dual Camera",3.9 out of 5 stars,"2,393",Price not found
"RCA 11 Delta Pro 2 11.6"" 128GB 2-in-1 Tablet with Folio Keyboard (Rainbow)",3.8 out of 5 stars,13,Price not found
"Rand McNally OverDryve 7 Pro Gen 2, 7-inch GPS Truck Tablet, Easy-to-Read Display, Dash Cam, Custom Routing, and Satellite Radio (OD7PROII)",3.5 out of 5 stars,18,549.99
"Tablet 10.1 Inch Android 9.0, 2 in1Tablet PC with Wireless Keyboard Mouse& Tablets Case, 4GB RAM +64GB ROM/128GB Computer Tablets, 8MP Quad Core/Dual Sim/8000 mAh,Support 3G/4G Phone Call (Green)",4.7 out of 5 stars,3,Price not found
"10 inch Android Tablet, Octa-Core CPU, 4GB RAM 64GB ROM with 1280x800 HD Display, 5G-WiFi Dual Camera, 3G-Unlocked with WiFi Bluetooth Tablets (Silver)",0,0,Price not found
"Rugged Tablet 10.1 in, 2GB RAM 16GB Storage Android7.0, Shockproof/Waterproof/Dustproof Tablets, 1280x800 IPS HD Display, GPS, FM, Wi-Fi",3.4 out of 5 stars,23,Price not found
"Kids Tablet - 7 Inch Tablet for Kids, Android 10.0 Edition Tablet with 2+32 GB, Parental Control & Kids Software Pre-Installed, WiFi DualCamera, IPS HD Screen Protector, with Kids-Proof Case (Pink)",0,0,Price not found
Kids Tablet 7 Android Kids Tablets for Kids Edition Tablet PC Android Quad Core Toddler Tablet with WiFi Dual Camera IPS Safety Eye Protection Screen and Parental Control Mode,3.7 out of 5 stars,"1,653",Price not found
"2 in 1 Tablet 10.1 Inch, Dual 4G SIM, Android 10 Tablet, 64GB ROM/128GB Tablet with Keyboard Mouse, Octa-Core Processor, 18MP Camera, 6000mAh, WiFi, GPS, Google Store Tablet PC(2021 Silver)",0,0,Price not found
Skylanders Trap Team Starter Pack - Wii,4.7 out of 5 stars,744,58.5
"Samsung Galaxy Tab A 8.0"", 32GB, Black (LTE AT&T & WIFI) - SM-T387AZKAATT",4.4 out of 5 stars,77,218.48
"Tablet 10.1 Inch, Android 10.0 Pie Quad-Coree Tablet+Keyboard with 4GB RAM 64GB ROM,1920 x 1200 IPS HD Display，4G WiFi 5MP and 8MP Cameras DUODUOGO P8 (10 inch, 4 GB RAM and 64 GB ROM, Black)",4.0 out of 5 stars,"1,015",Price not found
"Tablet 10 inch Android 10.0,Quad-Core Processor,2GB RAM,32GB Storage,3G Phone Tablets with Dual Sim Card Slots,1280x800 IPS HD Display,6000mAh Battery,Dual Cameras,WiFi, Bluetooth, GPS,Black",3.9 out of 5 stars,43,Price not found
"Blackview Tab8 Tablet, 10.1 inch Android 10 3g Phone Tablets with 64 GB Octa Core Processor, 1920x1200 IPS FHD Display, 13MP+5MP Dual Camera, GPS, FM, 5G WiFi, Grey",4.3 out of 5 stars,56,Price not found
"Tablet 10 Inch, 2021 Android 10 Tablet with 2GB RAM 32GB Storage, Dual Camera, Quad Core, HD IPS Touchscreen, WiFi, Bluetooth, GPS, GMS Certified - Black",4.2 out of 5 stars,8,Price not found
"TJD MT-1011OF 10 inch Android Tablet, Android 10.0 with Built-in Stand, 3GB RAM 32GB Storage, Octa-Core Processor, HD Display, Front 2.0MP Rear 5.0MP Camera, Y4.0 Bluetooth, WiFi, G-Sensor, GPS, Black",5.0 out of 5 stars,3,Price not found
"iProda Kids Tablet, 7 inch HD Display Android 9.0, Panda Toddler Tablet with 2GB RAM & 16GB ROM, Educational Games, Parental Controls, Best Gift for Kids",3.8 out of 5 stars,211,Price not found
10 inch Android 4.4 OS Tablet HD Display 8GB Storage Front Webcam Play Store for Entry Level Basic use,2.1 out of 5 stars,7,Price not found
"Lectrus Tablet 10 inch Android 9.0 (GMS Certified), 32GB Storage, Quad Core Processor, 3G Tablet PC with Dual Sim Card Slots and Cameras, IPS HD Touchscreen, WiFi, Bluetooth, GPS, YouTube, Netflix",3.9 out of 5 stars,794,97.99
"[3 Bonus Items] Simbans TangoTab XL 11.6 Inch Tablet and Keyboard, 2-in-1 Mini Laptop, Android 10, 4 GB RAM, 64 GB Storage, Mini-HDMI, 8MP Camera, USB, GPS, Dual WiFi, Bluetooth Computer PC - TLXL",3.9 out of 5 stars,7,Price not found
"Tablet 10 inch, Android 9.0 Pie, 2GB RAM, 32GB Storage, 3G Phablet, Quad-Core Processor, Dual SIM Card Slots and Cameras, WiFi, Bluetooth - Silver",3.9 out of 5 stars,114,Price not found
"Tablet 10 inch, Ultra-Fast Ten-Core 2 in 1 Android 9.0 Tablets, 3GB RAM 64GB Storage, 18MP Dual Camera, Wi-Fi, Bluetooth, GPS, 8000 mAh, Include Keyboard, Mouse, Tablet Case and More (Gray)",4.6 out of 5 stars,29,Price not found
"Venturer 11.6"" [WT9L11P44GD51] Windows Laptop/Tablet with Keyboard, 64GB Storage, 4GB RAM, Intel Pentium N5000 Processor, FHD Display",4.3 out of 5 stars,62,Price not found
"2 in 1 Tablet 10.1 inch Android 10.0 Tablets，4GB RAM 64GB ROM/128GB Expansion Tablet PC with Keyboard Mouse,5G/2.4G WiFi,Quad Core Processor10.1 IPS Touch-Screen,Dual Cameras, Bluetooth, 6000mAh",3.8 out of 5 stars,16,Price not found
"Tablet 10 inch, Android 9.0 Pie, 3G Phablet, 2GB RAM, 32GB Storage, Quad-Core Processor, Dual SIM Card Slot and Cameras, WiFi, Bluetooth - Black",3.8 out of 5 stars,244,Price not found
"Tablet 10.1 Inch Android 9.0 3G Phone Tablets with 2GB RAM+32GB ROM Dual Sim Card 2MP+ 5MP Camera, WiFi, Bluetooth, GPS, Quad Core, HD Touchscreen, Support 3G Phone Call (Black)",3.8 out of 5 stars,204,Price not found
"Haehne 7 inch Tablet, Android 9.0 Pie, Quad Core, 1G RAM 16GB Storage,7"" IPS Display, Dual Camera, WiFi Only, Bluetooth, Pink",3.4 out of 5 stars,457,Price not found
"Android Tablet 10 Inch with Sim Card Slots - 10.1"" 4GB RAM 64GB ROM Octa Core 3G Unlocked GSM Phone Tablet PC with WiFi Bluetooth GPS Netflix YouTube (Black)",3.5 out of 5 stars,142,Price not found
"Tablet 10 Inch Android 9.0, 2GB+32GB, Quad-Core Processor, 10 in 1280x800 IPS HD Display, 2MP+ 5MP, Bluetooth, WiFi, GMS 3G Phone Tablets - Silver",4.0 out of 5 stars,206,Price not found
"Alcatel 3T 8 9032T (32GB, 2GB) 8.0"" Cellular Tablet with Calling, 4080mAh Battery, Face Unlock, Android 10, GPS, US 4G LTE GSM Unlocked (T-Mobile, AT&T, Metro, Straight Talk) (Black)",3.8 out of 5 stars,23,133.99
"Tablet 10 inch, Android 9.0 Quad-Core Processor Tablet PC with 4GB RAM, 64GB Storage, Dual Sim Card Slots, Dual Camera, 1280x800 IPS Full HD Display, 4G Wi-Fi（Golden）",4.0 out of 5 stars,325,Price not found
"ZTE ZPAD 8 K83V 8"" 4G LTE Android HD Display Tablet Wi-Fi Verizon + GSM Unlocked 32GB 8MP Camera",4.1 out of 5 stars,4,120.05
"Tablet 10.1 Inch, Android 10.0 Tablets with 32GB ROM/128GB Expansion, 10.1"" IPS Touch-Screen,Quad-Core Processor,5.0 MP+ 8.0 MP Camera,Dual SIM 4G,8000mAh,Bluetooth, GPS, WiFi,Google GMS Certified",5.0 out of 5 stars,6,Price not found
"Android Tablet 7.5Inch, 2GB RAM 32GB ROM, 1440x1080 IPS Touch Screen, Quad-Core Processor, Android 10, 2MP+5MP Dual Camera, Wi-Fi, Bluetooth, Google Certified, Long-Lasting Battery, Purple",0,0,Price not found
"Tablet 8 inch, Android 9.0 Pie, 2 GB RAM 16 GB Storage, 1280x800 IPS HD Display, Wi-Fi, Bluetooth, Quad-Core, Black",0,0,Price not found
"10 Inch Tablet with Keyboard, Android 10 Tablet Octa-Core, 4GB RAM, 64GB Storage, 1080P Full HD Tablet with Cover Case Built-in Stand, Dual Speakers",0,0,Price not found
"TJD MT-701QU 7 inch Tablet,Android 10.0,1GB RAM 16GB ROM,Front 0.3MP, Rear 2.0MP Camera,Bluetooth,WiFi,G-Sensor,Diamond Shaped Designed Back,Black",2.2 out of 5 stars,20,Price not found
"Ultra Rugged Android Tablet Barcode Scanner, 8-inch / IP67 Waterproof/with Zebra 1D Laser Scan Engine/GPS, for Warehouse Management",4.2 out of 5 stars,11,Price not found
"Tablet 10 Inch Android Version, 3G Phone Tablets with 32GB Storage,Dual Sim Card,Support 3G Phone Call, HD Touchscreen,5MP Camera,WiFi, Bluetooth, GPS",3.7 out of 5 stars,70,Price not found
"Tablet 10 Inch Android 9 HD Touchscreen Phone Tablets with Sim Card, Quad Core, 32GB ROM /128 GB Expand, 3G Phone Call, WiFi, Bluetooth, Dual Camera, GPS, GMS Google Certified Tablet PC, (Black)",3.8 out of 5 stars,139,Price not found
"10 inch Google Android 8.1 Nougat System Unlocked Pad with Dual SIM Card Slot XINYANGCH 10.1"" IPS Screen 4GB RAM 64GB ROM 3G Phablet Built-in Bluetooth WiFi GPS Tablets (Metallic Black)",3.6 out of 5 stars,192,Price not found
"Android Tablet 10 Inch, 3G Phablet, Android 9.0 Tablets, 32GB Storage, Google Certified, Dual SIM Card Slot and Cameras, WiFi, Bluetooth – Silver",4.0 out of 5 stars,785,Price not found
"Android 9.0 Tablet, 4GB, 64GB, 1920x1200 IPS, 1080P FHD Touch Screen, up to 1.6Ghz Octa-core Processor, 5G/2.4G WiFi, GPS, Bluetooth 5.0 Tablet",3.3 out of 5 stars,3,Price not found
"Kids Tablets PC, Veidoo 7 inch Android 8.1 Tablet with Google Play Store GMS Certification 16GB Storage, IPS Screen, Premium Parent Control Pre-Installed iWAWA APP, Best Gift for Kids (Pink)",3.9 out of 5 stars,310,Price not found
"Tablet 10.1 inch Android 10 Tablet, 4GB RAM, 64GB Storage, IPS HD 1280X800, 1.5GHz Quad-Core Processor, Dual Band Wi-Fi, Bluetooth, 5000mAh Battery Life, 2 MP Front Mount and 13MP Rear Mount, Grey",4.3 out of 5 stars,85,Price not found
"qunyiCO Y10 Kids Tablet 10 inch, 2GB RAM 32GB Storage Android 10.0 WiFi Camera Bluetooth 1280 x 800 IPS HD Touch Screen Kid-Proof Case Parental Control Learning App on Google Certified Playstore …",0,0,Price not found
"HAOVM 10.1 Inch Android 10.0 Tablet,P20 MediaPad 1920x1200 IPS FHD Display Screen Tablets,Octa-Core 1.6GHz Processor,5MP+13MP Dual Camera,3GB RAM,64GB Storage,5G WiFi,128GB Expand,6000mAh,GPS,Silver",4.5 out of 5 stars,2,Price not found
YELLYOUTH 10 inch Tablet Android 10.0 Deca Core 4GB RAM 64GB ROM with Sim Card Slot 4G LTE Phone Call Phablet with WiFi GPS Bluetooth and Dual Camera Silver,3.7 out of 5 stars,46,Price not found
"Fusion5 7"" KD095 Kids Tablet PC - 64-bit Quad-core, Android 8.1 Oreo, WiFi, Parental Controls, Kids Learning Tools, 32GB Storage, Dual Cameras, Kids apps, Tablet PC for Kids (Pink)",3.4 out of 5 stars,134,Price not found
"Kids Tablet, Veidoo Educational 7 inch Android Tablet PC, Children Tablet with GMS Certified, Android 10, WiFi, Dual Camera, HD Display, Parental Control APP, Learning Tablets for Kids (Pink)",3.8 out of 5 stars,120,Price not found
"HUAWEI Mediapad M5 Lite 10.1 inch WiFi Android Games Tablet PC 4GB+64GB Microsd Kirin 659 Octa Core LTE 7500mah Android 8.0,Fingerprint Unlock,Gray",5.0 out of 5 stars,2,Price not found
"EGOTEK 7 Inch WiFi Tablet, Android 9 Pie GMS Certified OS, 2.5D Glass Touch Screen, IPS Screen,1.5GHz Quad Core, 2GB+16GB, 2.0+5.0MP Camera, Long Life Battery, Free Leather Case(Red)",3.2 out of 5 stars,52,Price not found
"2 in 1 Android 10.0 Tablet 10 Inch 5G Dual WiFi Tablets with Keyboard 4GB RAM 64GB ROM 128GB Expand, Quad-Core 1.6GHz Tablets, Bluetooth, 6000mAh, Type-C, Google GMS Certified Tablet PC",4.6 out of 5 stars,7,Price not found
"TECLAST P20HD Tablet 10 inch 4GB RAM 64GB ROM, 1.6GHz Octa-Core CPU Android Tablet, 1920x1200 FHD IPS, 2.4G+5G WiFi 2MP+5MP Camera, Bluetooth 5.0 Type-C GPS",0,0,Price not found
"[3 Bonus Items] Simbans TangoTab 10 Inch Tablet and Keyboard, 2-in-1 Android 10 Mini Laptop, 4 GB RAM, 64 GB Storage, Mini-HDMI, USB, GPS, Dual WiFi, Bluetooth Computer PC - New 2021 Model - TLX2",4.3 out of 5 stars,3,Price not found
"10 Inch Tablet, Android Tablet with 2GB+32GB, Dual Sim Card 5MP Camera, WiFi, Bluetooth, GPS, Quad Core, HD/IPS Touchscreen, Support 3G Phone Call, Google Certified Tablet (Silver)",3.4 out of 5 stars,207,Price not found
"Tablet 10 Inch 5G Wi-Fi, Octa-Core Android 9.0 Pie Tablets, 2GB+32GB, 13.0MP & 5.0MP Dual Camera, Bluetooth 5.0, GPS/FM Support - Gray",1.0 out of 5 stars,1,Price not found
"TJD 10 inch Tablet with Stand and case,Android 10 Google Tablet 2GB RAM, 32GB ROM,1280x800 IPS Display, Dual Cameras, Google Certified, Blue",4.2 out of 5 stars,37,Price not found
"Samsung Galaxy Tab E 8.0"" SM-T377A 16GB Android Tablet WIFI + 4G LTE (GSM Unlocked) - Black",4.1 out of 5 stars,262,189.44
"Tablet 10 Inch, 3G Phablet, 16GB Storage, 5MP+2MP Dual Camera, 1280x800 IPS Touchscreen, Support Wi-Fi, Bluetooth, GPS - Black",3.9 out of 5 stars,259,Price not found
"Android 10.0 Tablet, Memzuoix 10.1 Inch FHD Tablet PC with Octa-Core Processor| 3GB RAM+64GB ROM| 1920x1200 IPS, Camera, 7,000mAh Battery Wi-Fi Bluetooth, Space Black",2.5 out of 5 stars,2,Price not found
"7 Inch Kids Tablet, Android 9.0 Edition, 2+32GB, WiFi Tablets, Parental Control, Preloaded Learning & Training Apps, Games, Kids Software Pre-Installed with Kids-Proof Case (Blue)",0,0,Price not found
RCA 11 inch Delta Pro 2 Laptop Tablet with Detachable Keyboard,5.0 out of 5 stars,1,159.99
"RCA 10"" Quad-Core 2GB RAM 32GB Storage Touchscreen WiFi Bluetooth with Detachable Folio Keyboard Android 10 Tablet (Silver)",0,0,Price not found
"Fusion5 104Bv2 PRO 64GB Android Tablet PC - (Android 9.0 Pie, Bluetooth, Dual-Band Wi-Fi, HDMI, IPS Screen, GPS, FM and Quad-Core CPU Fast Multitasking for HD Videos, Movies, Gaming)",3.9 out of 5 stars,30,119.97
"Tablet 10.1 inch Android 10.0, 2GB RAM 32GB Storage, Quad-Core Processor, 1280x800 IPS HD Display, 5000mAh Battery, 3G Phone Tablets & Dual Sim Card, Bluetooth, GPS, WiFi (Silver)",5.0 out of 5 stars,1,Price not found
"Tablet with Keyboard, Android 9.0 Tablet PC, 10.1 Inch Quad-Core with 3GB RAM, 32GB Storage,8MPDual Camera Dual SIM,GPS,Bluetooth,WiFi -Black",3.6 out of 5 stars,137,Price not found
"High-Performance Tablet, 10-inch Tablet with Keyboard and Mouse, Android 9.0 Quad-Core Processor Tablet, 3GB RAM +64GB with Google GMS Certification, 4G WiFi, 8000 mAh, FM, GPS, Bluetooth, OTG",3.9 out of 5 stars,131,Price not found
"Newest Lenovo Flex 3 11.6"" 2-in-1 Touchscreen Chromebook----MediaTek MT8173C, 4GB Memory, 32GB eMMC Flash Memory, Platinum Grey",4.6 out of 5 stars,3,Price not found
"Kids Tablet, 7 Inch Andriod 9.0 Tablet for Kids, 2GB +16GB, Kids Mode Pre-Installed, Educational Apps, Games, Camera and WiFi - Kids-Proof Case Pink",3.7 out of 5 stars,400,Price not found
"Visual Land Prestige Elite 10.1"" IPS [2 in 1] Quad Core 64Bit 16GB Android 7.0 Nougat Tablet with Docking Keyboard Case Stand, Paisley (ME10QDDC16MAGP)",3.7 out of 5 stars,111,99.99
"10.1 inch Android Tablets,iProda T1045A Tablets 1280x800 HD IPS Screen,3GB RAM,64GB,Android 9.0 Quad Core Processor,Dual-Band Wi-Fi,GPS,Metal Shell",3.7 out of 5 stars,55,119.98
"Android Tablet 10 Inch, 5G WiFi Tablet, 16 GB Storage, Google Certified, Android 8.1 Go, Dual Camera, Bluetooth, GPS - Silver",4.0 out of 5 stars,319,Price not found
Samsung Galaxy Tab A7 10.4 Wi-Fi 32GB SM-T500 Gray,4.6 out of 5 stars,23,234.99
"Samsung Galaxy Tab S2 9.7"" 32GB Wifi Tablet Silver",5.0 out of 5 stars,1,269.17
"Ematic 10.1"" EGQ239BD 16GB Tablet Bundle (Wi-Fi, Black)",4.0 out of 5 stars,13,109.99
"[4 Bonus Item] Simbans TangoTab 10 Inch Kids Tablet with RED Bumper Case 4 GB RAM, 64 GB Disk, Android 10, WiFi, USB, HDMI, Bluetooth, 2+5 MP Camera Computer PC - TKX",3.6 out of 5 stars,181,Price not found
"Victbing Android 10.0 Tablet 10 inch, 2GB RAM, 32GB, Quad-Core, 3G SIM Phone Tablets, Dual Cameras & Speakers, 1280x800 IPS HD Touchscreen, WiFi, Bluetooth, USB Type-C, Google Certified, GPS – Silver",4.0 out of 5 stars,798,Price not found
"Rand McNally 8PRO OverDryve 8 PRO 8"" Dashboard Tablet with GPS",3.6 out of 5 stars,25,599.99
"mayceyee 10.1"" FHD Tablet PC, with Android 10.0 System, Octa-core Processor, 3GB RAM, 64GB Storage, 64GB Extend TF Card Port, 7000mAh Battery, Wi-Fi and Bluetooth",2.9 out of 5 stars,4,Price not found
"Samsung Galaxy Tab A T515 10.1"" (WiFi + Cellular) 4G LTE GSM International Version 32GB Tablet Bundle with Case, Screen Protector, Stylus and 32GB microSD Card [Gold]",4.6 out of 5 stars,453,289.99
10.1Inch 1280x800 IPS Tablet PC 2G RAM 32G ROM Android 7.0OS Cameras Quad-core CPU Cameras WiFi AGPS 3G SIMfree Playstore (Silver),3.7 out of 5 stars,120,Price not found
"Android Tablet 10 inch, Android 10.0 OS, 2GB+32GB, Quad Core, 10.1 inch 1280x800 IPS HD Screen, Google Tablet with Micro SD & Dual Camera, WiFi, USB Type C Port, Bluetooth, GPS, FM, Black",4.2 out of 5 stars,28,Price not found
"2 in 1 Tablet 10.1 inch Android 9.0 Tablets, 4GB RAM 64/128GB ROM Tablet PC with Keyboard Mouse, 13MP Dual SIM 4G /WiFi Quad Core Computer Tablets, 8000mAh, GPS, Bluetooth, with Tablet Case (Green)",3.0 out of 5 stars,3,Price not found
"Jumper 11.6 inch Full HD Touchscreen Laptop 4GB RAM, 128GB eMMC 360 Degree Convertible Tablet PC Windows 10 Ultrabook PC Intel Celeron N4100 Quad Core Processor",4.0 out of 5 stars,10,Price not found
"RCA 11.6"" Tablet with Keyboard Folio (Black)",5.0 out of 5 stars,1,Price not found
"Samsung Galaxy Tab A 8.0"" 16GB Smoky Titanium - SM-T350NZAAXAR",4.5 out of 5 stars,876,Price not found
"RCA Under Cabinet Speaker Dock with 11.6"" Space Saver Android Tablet 2GB RAM 32GB",4.2 out of 5 stars,28,Price not found
"HP OfficeJet Pro 69Series Color Inkjet All-in-One Wireless Printer - 4-in-1 Print, Scan, Copy, Fax for Office - Instant Ink Ready - 2.65"" CGD Touchscreen, 20 ppm Print Speed",5.0 out of 5 stars,2,Price not found
"2020 New Android Tablet 10 Inch, Android 9.0 Pie, GMS Certified, 4GB RAM 64GB Storage, Quad-Core Processor, IPS HD Display, Wi-Fi, Bluetooth, GPS",3.1 out of 5 stars,49,Price not found
"Kids Tablet, Android 9.0 Tablet for Kids, 2GB RAM & 16GB ROM, Kids Edition Tablet with Kids-Proof Case Parental Control WiFi, Pink",3.5 out of 5 stars,244,Price not found
"LENOVO 10E CHROMEBOOK Tablet, MTK MEDIATEK MT8183 Processor (2.00GHZ, 1MB), 10.1",4.3 out of 5 stars,7,242.99
"10 inch Android Google Tablet, Android 9.0 Pie, GMS Certified, 2GB RAM, 32GB Storage, Quad-Core Processor, IPS HD Display, Wi-Fi, Bluetooth, GPS",3.6 out of 5 stars,182,Price not found
"2 in 1 Tablet 10 Inch Android 10.0 Tablets, 4GB RAM 64GB ROM Tablet PC with Keyboard Mouse,8MP Dual Camera,Dual 4G / WiFi,8000mAh, GPS, Bluetooth, Google Certified Tablet",5.0 out of 5 stars,2,Price not found
"Kids Tablet 10 Inch, 3G Phone Tablets for Children, Android 10 Tablet 32GB ROM, 2GB RAM, 1280x800 HD IPS Display, WiFi Android Tablet for Toddlers, Kid-Proof Case, Blue",4.0 out of 5 stars,2,Price not found
"Tablet 10.1 inch Android 9.0 Go 1280x800 IPS HD Display with Wireless Keyboard Case Quad-Core 1.3Ghz Processor, 3 GB RAM, 32 GB Storage, 8MP Rear Camera, Bluetooth, Wi-Fi, USB, GPS",3.8 out of 5 stars,401,Price not found
