name,ratings,number of ratings,price
"Android Tablet 10 Inch, 5G WiFi Tablet, 16 GB Storage, Google Certified, Android 8.1 Go, Dual Camera, Bluetooth, GPS – Black",3.9 out of 5 stars,"3,122",Price not found
Samsung Galaxy Tab A 8.0 Inches 2019 T295 LTE (32GB) Factory Unlocked Tablet,4.3 out of 5 stars,182,Price not found
"Tablet 10.1 Inch Android 10.0, 4GB+64GB/ 128GB Extend Octa-Core 1.6 GHz Processor Tablets,13MP Rear Camera, Bluetooth 5.0, Wi-Fi, GPS + Tablet with Keyboard Case. (64G)",4.6 out of 5 stars,9,Price not found
"Tablet 10 Inch Android 10.0 OS with 32GB Storage, 5MP Rear Camera, Quad Core 1.6GHz, WiFi Tablet, Bluetooth, GPS, HD Touchscreen, Google Certified (Black)",4.3 out of 5 stars,7,Price not found
"Tablet 10.1 Inch Android 10.0 4G Phone Tablets with 4G RAM, 64GB Storage, Dual Sim Card Slot, 13MP Camera, WiFi, Bluetooth, GPS, Octa Core Processor, HD Touchscreen, Support 4G Phone Call (Gray)",0,0,Price not found
"Lenovo Tab M10 HD 10.1"" Tablet, Android 9.0, 16GB Storage, Quad-Core Processor, WiFi, Bluetooth, ZA4G0000US, Slate Black",4.4 out of 5 stars,"2,613",179.99
"GOODTEL G6 7"" Kids Tablets 16 GB ROM 128GB Extended Memory，GMS Google Certification Android 10 Tablet Quad-Core,Google Play Pre Installed,IPS HD Display,Kid-Proof Case (Blue)",3.8 out of 5 stars,"1,172",Price not found
"Samsung Galaxy Tab S6 Lite 10.4"", 64GB WiFi Tablet - SM-P610 - S Pen Included (International Model) (Oxford Gray)",4.9 out of 5 stars,182,349.99
"RCA 11 Delta Pro 11.6 Inch Quad-Core 2GB RAM 32GB Storage IPS 1366 x 768 Touchscreen WiFi Bluetooth with Detachable Keyboard Android 9.0 Tablet (11.6"", Pink)",4.1 out of 5 stars,"1,224",Price not found
"Kids Tablet 7 inch Android 9.0 Kids Tablets Toddler Tablet Kids Educational Tablet with WiFi Childrens Tablet 1GB + 8GB Parental Control, Google Play Store-Blue",3.7 out of 5 stars,619,Price not found
"Samsung Galaxy Tab A7 10.4"" 2020 (32GB, 3GB) Wi-Fi Only Android 10 One UI Tablet, Snapdragon 662, 7040mAh Battery, International Model SM-T500 (Dark Gray)",4.6 out of 5 stars,164,221.99
"Pritom 7 inch Tablet - Android 9.0 Oreo Go Tablet PC with 32 GB Storage, Quad Core Processor, HD IPS Display, Dual Cameras, WiFi, Bluetooth - Android Tablet, Black",3.9 out of 5 stars,958,Price not found
"Samsung Galaxy Tab S6- 10.5"" 256GB, Wifi Tablet- SM-T860NZALXAR, Mountain Gray",4.7 out of 5 stars,"3,756",649.0
Kids Tablet 7inch Tablet for Kids Android Toddler Tablet HD Display 32GB Kids APP Preinstalled Learning Tablet WiFi Education Dual Cameras with Kid-Proof Case YouTube Netflix Google Play Store,3.8 out of 5 stars,243,Price not found
"RCA Android Tablet Bundle (8″ Tablet, Audio Books, Bumper Case, Headphones) – Disney Edition Pink",4.3 out of 5 stars,276,Price not found
"Tablet 10.1 inch Android Tablet AWOW, 1.5GHz Quad Core, 2GB RAM, 16GB ROM, 1280 x 800 HD IPS, 0.3MP & 2MP Camera, Android 10（Go Edition）, 2.4G WiFi, Bluetooth 4.0, 5000mAh Battery Capacity",4.0 out of 5 stars,197,Price not found
Kids Tablet 7 inch Toddler Tablet Android Tablet for Kids 16GB 4000Mah Parent Control with Pre-Installed Educational APP WiFi Kids Edition Learning Tablet Kid-Proof Case (Pink),4.0 out of 5 stars,591,Price not found
"RCA 14"" Luna Max [RCT6T48Q35] Quad-Core 3GB RAM 128GB Storage IPS 1920 x 1080 FHD Touchscreen WiFi Bluetooth with Detachable Keyboard Android 10 Tablet (Copper Marble)",4.1 out of 5 stars,33,229.99
RCA Dual 10 inches Fast Quad Core Tablets 16GB & DVD Player Combo - 2 Tablets 1 DVD Player Kit Touchscreen WiFi with Android OS,4.1 out of 5 stars,19,Price not found
"Beneve Kids Tablet 7 inch IPS HD Display Android Tablet for Kids Toddler Tablet Kids Edition Tablet with WiFi Dual Camera Childrens Tablet 2GB + 16GB Parental Control,Google Play Store (Red+Pink)",4.0 out of 5 stars,106,Price not found
"SANNUO 10 inch Kids Tablet,Android 10.0 RAM 3GB ROM 32GB 3G LET Dual SIM Card for Kids Education, Watch Movie and Play Game(Pink)",4.3 out of 5 stars,115,Price not found
"Samsung Galaxy Tab A 10.1"" (2019, WiFi Only) Full HD Corner-to-Corner Display, (32GB, 2GB RAM), Tablet SM-T510, (International Model) (WiFi Only, Gold)",4.6 out of 5 stars,"1,149",Price not found
"Padgene Kids Tablet 7 Inch,Android 9.0 Parental Control Kids Mode Pre-Installed WiFi Tablet Learning Games Camera IPS HD Display 1 GB+16GB with Kid-Proof Case (7 Inch, Blue)",3.6 out of 5 stars,"3,811",55.99
"RCA 11.6"" 2GB RAM 128GB Storage 2-in-1 Tablet with Keyboard Touchscreen WiFi Bluetooth and DJ Headphones (Red Python)",4.2 out of 5 stars,121,156.99
"10 Inch Tablet with Case Built-in Stand, Android Tablet 10 Inch, Android 10.0, 3GB RAM 32GB Storage, 5MP+8MP Dual Cameras, WiFi, Bluetooth, 1.6GHz Quad-Core, IPS HD Touchscreen WiFi Tablet (Black)",4.0 out of 5 stars,48,Price not found
"Android 10.0 Tablet 10 Inch, Octa-Core Processor, 2.4G WiFi, 1920x1200 HD ThouchScreen Large Tablets with 13MP Rear Camera, 6000mAh Battery, 32GB ROM 128GB Expand Storage, Bluetooth/GPS/FM/OTG",4.1 out of 5 stars,95,Price not found
"CHUWI Hi10 X Tablet with Keyboard and Stylus Pen, 10.1"" 2 in 1 Tablet PC, Intel N4120 Quad-core, 6GB LPDDR4 128GB eMMC, 1920x1200 FHD IPS Multi-Touch Display, 2xType-C, BT5.1, Dual Wi-Fi, Windows 10",4.0 out of 5 stars,412,Price not found
Tablet 10-Inch Android 10.0 - WINNOVO WinTab P20 Octa Core Processor 3GB RAM 64GB Storage 1920x1200 FHD IPS Display 13MP Rear Camera 5G WiFi Bluetooth 5.0 GPS FM Brushed Metal Shell (Grey),4.0 out of 5 stars,21,Price not found
"Contixo V9-3-32 7 Inch Kids Tablet, 2GB RAM 32 GB ROM, Android 10 Tablet, Educational Tablets for Kids, Parental Control Pre Installed Learning Game Apps WiFi Bluetooth Tablets for Kids 6+ Age, Purple",3.9 out of 5 stars,893,Price not found
"Vanquisher 8-Inch Industrial Rugged Tablet PC, Windows 10 Pro/GPS GNSS / 4G LTE/Drop Survival, for Enterprise Field Mobility",4.1 out of 5 stars,35,569.99
RCA 11 Delta Pro 11.6 Inch Quad-Core 2GB RAM 32GB Storage IPS 1366 x 768 Touchscreen WiFi Bluetooth with Detachable Keyboard Android 10 Tablet,4.3 out of 5 stars,336,Price not found
"2021 Newest Lenovo Smart Tab M8 with Google Assistant, 8 inch 1280x800 IPS Touchscreen Android Tablet, Quad-Core Processor, 2GHz RAM, 32GB Storage, Long Battery Life, Android 9 Pie + Oydisen Cloth",4.5 out of 5 stars,74,149.99
"Venturer 14"" Luna Max [VCT9T48Q34RBM] Quad-Core 3GB RAM 64GB Storage IPS 1920 x 1080 FHD Touchscreen WiFi Bluetooth with Detachable Keyboard Android 10 Tablet",4.0 out of 5 stars,80,198.99
"CHUWI UBook X 12 inch Touchscreen Tablet PC Bundled with Keyboard and Stylus Pen, 8GB RAM 256GB SSD, 2160x1440 Pixels Display,Intel N4100 Quad Core Processor, Type-C Dual Wi-Fi, Windows 10 - Gray",4.1 out of 5 stars,325,Price not found
"Vizio XR6M10 6"" Touch Screen Android Tablet with Bluetooth and Smartcast Capabilities.",4.1 out of 5 stars,295,Price not found
"Kids Tablet 7 inch, Android 9.0 Tablet for Kids, 2GB+16GB, Pre-Installed Parent Control IPS HD Display, WiFi Android Tablet, Kid-Proof, Learning Tablet Rose",5.0 out of 5 stars,16,Price not found
"TJD MT-1010OF 10 inch Tablet, Android 10.0 Tablet with 2GB RAM 32GB Storage 128GB Extended Memory, Octa-Core Processor, HD Display, Front 2.0MP Rear 5.0MP Camera, Y4.0Bluetooth, G-Sensor, GPS, Black",4.1 out of 5 stars,9,Price not found
"Samsung - Galaxy Tab A - 8"" - 32GB - Silver with WiFi Portable Tablets, iPuzzle 32GB SD Card",4.5 out of 5 stars,33,149.95
"CHUWI UBook 11.6'' Touchscreen Windows 10 Tablet PC, Intel N4100 Quad Core Processor, 1080P Display, 8GB RAM/256GB SSD with Type-c, USB 3.0(Keyboard and Pen not Included)",3.9 out of 5 stars,85,Price not found
"10.1 inch Kids Tablets Android 10 Go, 2+32GB ROM, KIDOZ Pre-Installed, 2.4G WiFi only, 1024x600 Touchscreen, AWOW Funtab 1001, Adjustable Kid-Proof Case, Active Pen (10.1-inch-KIDOZ-232-Blue)",4.6 out of 5 stars,52,Price not found
"Fusion5 7"" Android 10 Q Go Tablet PC - (Google Certified Android 10, 2GB RAM, 32GB Storage, WiFi, BT, 1024x600 IPS Screen, 5MP and 2MP Cameras, F704Bv2 Model Tablet PC)",3.8 out of 5 stars,193,69.97
Android 10.0 Tablet 10 inch with Sim Card Slots 4GB RAM 64GB ROM Quad Core 3G Unlocked GSM Phone Tablet PC Compatible with Bluetooth WiFi GPS (White),4.2 out of 5 stars,7,Price not found
"Android Tablet 10 Inch, 5G WiFi Tablet with Dual Camera, 16GB Storage, Android 8.1 Tablets PC, Quad-Core Processor, Google Certified, 1280x800 IPS HD Display, Bluetooth, GPS, FM - Black",4.0 out of 5 stars,"1,563",Price not found
"Kids Tablet 7 inch Quad Core Android Tablet Works 8 Hours,Eyes Protection Screen, Dual Cameras, Parental Control, Pre-Installed Educational Free Kids APP, Kids Games App,Google Play Store",3.8 out of 5 stars,312,Price not found
"Android Tablet 10 inch, Dual Band 5G/2.4G WiFi Tablets, Quad-Core, 16GB Storage, Dual Cameras & Speakers, 1280800 IPS HD Display, SD Card Slot, Support OTG, USB, GPS, Bluetooth, FM, 6000mAh - Silver",3.8 out of 5 stars,460,Price not found
"Kids Tablets 7"" 2GB RAM 32GB Storage Android 10 Kidoz Learning Tablet IPS HD Display WiFi Tablet for Girls, Compatible with Disney + APP, Pink",4.2 out of 5 stars,437,Price not found
"Tablet for Kids,7 inch Kids Tablet Android 9.0 Edition Tablet with WiFi and Bluetooth,GMS Certified, 2GB+16GB Tablet for Kids,Children Tablet with Parental Control",3.7 out of 5 stars,245,Price not found
"HAOVM Mediapad P10 10inch Tablet, Android 10.0, Octa-Core 1.6GHz Processor, 3GB RAM 32GB Storage 8.0MP Camera, 10.1"" IPS HD Display, Wi-Fi, USB Type C Port, GPS, FM, Brushed Texture Back",4.2 out of 5 stars,47,Price not found
Kids Tablet 7 Inch IPS HD Quad Core Android 10.0 Tablet PC for Kids - GMS Certificated Dual Cameras 2GB RAM 32GB ROM WiFi with Handheld Kids-Proof Silicon Case for Kids Educational（Pink）,3.8 out of 5 stars,908,Price not found
"HP Chromebook 14-inch Laptop with 180-Degree Hinge, Full HD Screen, AMD Dual-Core A4-9120 Processor, 4 GB SDRAM, 32 GB eMMC Storage, Chrome OS (14-db0040nr, Chalkboard Gray)",4.4 out of 5 stars,"4,275",Price not found
7inch Tablet for Kids 3-14 Android Toddler Tablet 32GB Dual Cameras Tablet Kids APP Preinstalled & Parent Control Kids Tablet WiFi Learning Tablet for Toddlers YouTube Netflix Google Play Store,3.7 out of 5 stars,847,Price not found
Venturer 10.1 Inch 2-in-1 Detachable Windows Laptop,4.4 out of 5 stars,6,154.99
"Tablet 10 inch Android 10 Tablet Octa-Core Processor with 32GB Storage, Dual 13MP+5MP Camera, WiFi, Bluetooth, GPS, Support 128GB Expand, IPS Full HD Display 2021 Latest Update (Silver)",4.8 out of 5 stars,41,Price not found
"Android 10, 8-inch Android Tablet, Vastking Kingpad SA8 Octa-Core Processor, 3GB RAM, 32GB Storage, 1920x1200 IPS, 5G Wi-Fi, GPS, 13MP Camera, Blue Light Filter Screen, Silver Grey",3.9 out of 5 stars,63,Price not found
"VUCATIMES N20 10-inch Tablet, Android 10.0, Octa-Core Processor, 3GB RAM, 64GB ROM, IPS 1200x1920 FHD Display, 13.0MP Camera, 5G Wi-Fi, Bluetooth 5.0, USB, GPS, FM, Metal Body (Gray)",4.2 out of 5 stars,64,Price not found
"2020 Samsung Galaxy Tab A 8.0"" Tablet (Latest Model), 32GB, Android 9.0 Pie, 1280x800 Resolution, Dual Camera, Wi-Fi, Bluetooth,13+ Hour Battery, w/Marxsol 32GB SD Card, White",4.1 out of 5 stars,55,Price not found
"Tablet 10 Inch - LNMBBS Octa-Core,Android 10.0 Google GMS Certified,4GB RAM + 64GB ROM,128GB Expandable,Wi-Fi,Keyboard,Mouse,Tablet Cover and More Include - Gray",5.0 out of 5 stars,17,Price not found
"Tablet PC, Veidoo 10.1"" Inch Tablet, HD Screen, IPS Display, Dual Camera, WiFi/GPS/OTG, 3G Phablet with Dual Sim Card Slots, 1GB Memory, 16GB Storage, Android Tablet PC (Black)",3.9 out of 5 stars,709,Price not found
"TECLAST Android Tablet 8 inch 1.6GHz Quad Core Processor, Android 10 Tablet, 2GB RAM 32GB ROM Tablet, 1280x800 HD IPS Display, 2.4G+5G WiFi Bluetooth 5.0 Type-C GPS TF Expansion 2MP Rear Camera",3.5 out of 5 stars,41,Price not found
"Kids Tablet 7 inch Tablet for Kids with Case Android 9.0 GMS WiFi 3GB RAM 32GB ROM Eye Protection HD Touch Screen with Dual Camera, Educational,Games,Parental Control Learning Kids Software",3.9 out of 5 stars,102,Price not found
"Lenovo Tab M10 FHD Plus 10"" Tablet 32GB WiFi MediaTek Helio P22T, Iron Grey (Renewed)",2.5 out of 5 stars,2,132.99
"MARVUE Pad M30 Tablet, 10.1 Inch Android 10 Tablets, 3 GB RAM 32 GB ROM Storage,13MP+5MP Dual Camera, WiFi, FM, GPS, 1.6GHZ Octa-Core Processor, 1920x1200 IPS FHD Screen Tablet (Black)",4.6 out of 5 stars,40,Price not found
"Android 10 inch Tablet PC, Octa-Core CPU, 4GB RAM 64GB ROM, IPS HD Display 1280×800, Dual Sim Card Slots, Calls, Internet Entertainment, High-Definition Audio and Video (Black)",3.5 out of 5 stars,36,Price not found
"Tablet 10 inch Android 9.0 Pie OS, 4 GB RAM 64 GB Storage, 5MP Rear Camera, Quad-Core Processor, 10.1 inch IPS HD Display, Wi-Fi",3.7 out of 5 stars,160,Price not found
"SAMSUNG Galaxy Tab S7 (5G Tablet) LTE/WiFi (AT&T), Mystic Black - 128 GB (2020 Model - US Version & Warranty) - SM-T878UZKAATT",5.0 out of 5 stars,3,849.99
"Venturer Small Wonder 7"" Android Kids Tablet with Disney Books, Bumper Case & Google Play, 16GB Storage & 2GB RAM Dual Band 5GHz/2.4GHz WiFi (Blue)",4.3 out of 5 stars,481,59.99
"Venturer Small Wonder 7"" Android Kids Tablet with Disney Books, Bumper Case & Google Play, 16GB Storage & 2GB RAM (Purple)",4.3 out of 5 stars,233,69.99
"Samsung Galaxy P610 Tab S6 Lite 10.4-Inch 64 GB WiFi Android 10 Touchscreen Tablet (Oxford Gray) Bundle S Pen Included - Hard Case, Screen Protector, 32GB microSD Card",4.5 out of 5 stars,75,359.99
"Tablet 10.1 inch, 2 in 1 Tablet with Keyboard Case Quad Core 1.3Ghz Processor, Android 9.0 GO Tablets, HD 1280 x 800 IPS Display, Type-C,BT4.2,WiFi,64GB Storage, Metal Body-Blue",4.1 out of 5 stars,672,Price not found
"Contixo K101A 10 inch IPS Display Kids Tablet with 2GB RAM 16GB ROM Android 10 Parental Control for Children Infant Toddlers at Home School, Educational Tablet for Kids, WiFi, Child-Proof Case (Red)",4.1 out of 5 stars,232,119.95
"Tablet 10 inch Android OS, Quad Core, Google Certified Tablets with SD Card Slot, Dual Cameras & Speakers,16GB Storage, 5G+2.4G WiFi, 1280×800 HD Touchscreen, Bluetooth, GPS, 6000mAh – Black",3.9 out of 5 stars,"2,628",Price not found
"[3 Bonus Items] Simbans TangoTab 10 Inch Tablet and Keyboard 2-in-1 Laptop, 3 GB RAM, 64 GB Disk, Android 9 Pie, Mini-HDMI, Micro-USB, USB-A, Inbuilt GPS, Dual WiFi, Bluetooth Computer PC - TL93",3.9 out of 5 stars,"1,726",Price not found
"[3 Bonus Items] Simbans TangoTab 10 Inch Tablet and Keyboard 2-in-1 Laptop, 4 GB RAM, 64 GB Disk, Android 10, Mini-HDMI, Micro-USB, USB-A, Inbuilt GPS, Dual WiFi, Bluetooth Computer PC -TLX",3.8 out of 5 stars,351,Price not found
"RCA Voyager 7” Android 10 Tablet w/Google Play, 16GB Storage, 2GB RAM, WiFi, Camera",3.7 out of 5 stars,241,59.99
"2 in 1 Android Tablets 10 Inch, 64GB ROM 4GB RAM Tablet PC with Wireless Keyboard Mouse, Quad Core, HD/IPS,Dual 4G SIM/WiFi, 8000mAh, GPS, Bluetooth, Google Certified Computer Tablet",4.4 out of 5 stars,16,Price not found
"SANNUO Kids Tablet 10.1 inch, GMS-Certified Android 9.0,Kids -Mode,2GB RAM,2.0+5.0MP Dual Camera,IPS1280x800 Screen,3G,GPS,Google Play with Learning App for Children.",4.0 out of 5 stars,"1,276",Price not found
"VIVIMAGE 10.1 inch Tablet, Android 10, 3G Phone Tablets with Dual SIM Card, 32 GB Storage, 8MP Camera, Quad-Core Processor, 10"" HD Display, Wi-Fi, USB Type C Port, GPS, Black",5.0 out of 5 stars,4,Price not found
"Tablet 10 Inch, Android 10 Tablet, 3G Phablet with Dual Sim Card & 5MP Camera Tablet PC, 2GB+32GB Storage, 1280x800 IPS HD Touchscreen, Quad Core, WiFi, Bluetooth, GPS, 2G/3G Phone Network(Black)",3.6 out of 5 stars,178,Price not found
"PRITOM Tablet 7 inch, Android 9.0 Tablet PC with 2 GB RAM, 32 GB Storage, Quad-Core Processor, IPS HD Display, Wi-Fi,Bluetooth, Dual Camera, Android Tablet with Cover Case (Black1)",4.1 out of 5 stars,28,Price not found
"Android Tablet, Octa-Core CPU, 3GB RAM, 32GB, Support 2.4+5G Wi-Fi, 8MP Dual Camera, FM, GPS, 10.1Inch Tablets，1080P Full HD Display for Online Lesson,Reading (Silver)",4.3 out of 5 stars,71,Price not found
"Android Tablet 10 Inch, 3G Phone Tablets with 32GB Storage, Dual SIM Card Slots, Quad-Core Processor, HD Touchscreen, WiFi, Bluetooth, GPS - Silver",3.9 out of 5 stars,"1,336",Price not found
"10 Inch Tablet 8 Core - TOSCIDO Android 10.0 Ultra-Fast,2GB RAM 32GB ROM,72 Hours Long Standby,WiFi Support/Bluetooth4.2/ Keyboard/Mouse/Tablet Cover and More Include - Golden",4.3 out of 5 stars,369,Price not found
"KUNWFNIX Kids Tablet 7 inch,GMS-Certified Android 9.0 and Kids-Mode Dual System,Quad Core,1GB RAM,16GB ROM,Dual Camera,Full HD Screen,Google Play and Learning App for Children",3.5 out of 5 stars,236,66.99
"Android Tablet 10 Inch, 5G WiFi, Quad-Core Processor, 16GB Storage, 1280x800 IPS HD Display, Android 8.1 Go, Dual Camera, Bluetooth, GPS, Google Certified Tablets PC - Black",4.0 out of 5 stars,551,Price not found
RCA 11 Delta Pro 11.6 Inch Quad-Core 2GB RAM 32GB Storage IPS 1366 x 768 Touchscreen WiFi Bluetooth with Detachable Keyboard Android 9.0 Tablet (Burgundy),4.2 out of 5 stars,109,Price not found
"Lectrus Tablet 7 inch Android 9.0 Pie (GMS Certified), 2GB+16GB Storage, WiFi Android Tablets for Kids, 1080p Full IPS HD Display, Dual Camera, Google Play, Kid-Proof Case, Parental Control, Pink",3.9 out of 5 stars,164,Price not found
"Kids Tablet 7 inch Android 10.0 - Kids Edition Tablets with Case - Quad Core - RAM 1GB | 16GB ROM - JUSYEA J3-3000mAh Battery | WiFi | Bluetooth, Entertainment | Education (Pink)",3.7 out of 5 stars,42,Price not found
"Tablet 10.1 Inch Android 10.0 Tablets 4 GB RAM 64 GB ROM Storage, 5G WiFi, Quad Core Processor, 8000mAh Battery/Type-C",0,0,Price not found
"Tablet for Kids, 7 Inch Kid Tablets Edition Android 9.0 with WiFi, 2+16GB, Parental Control, Preloaded Learning & Training Apps, Games for Toddlers 2-10 and Child Tablet Cover Kid-Proof Case (Blue)",4.0 out of 5 stars,469,Price not found
"Samsung Galaxy Tab A 8.0"" with S Pen (2019) 32GB, 4200mAh Battery, 4G LTE Tablet GSM Unlocked SM-P205, International Model (Wi-Fi + Cellular, Gray)",4.6 out of 5 stars,771,254.99
"MARVUE Pad M20 Tablet, 10.1 Inch Tablet Android 10 Tablets, 2GB RAM 32GB Storage, 8MP+5MP Dual Camera, Wi-Fi, Bluetooth, HDMI, FM, GPS, 6000mAh Battery, 1280x800 IPS HD Screen Tablet (Black)",5.0 out of 5 stars,15,Price not found
"Samsung Galaxy Tab A 8.0in 16GB, Wi-Fi Tablet - Black (Renewed)",4.4 out of 5 stars,452,129.0
10 Inch Android 4.4 Tablet by Azpen for Internet Browsing and Social Media Basic Use Entry Level,2.3 out of 5 stars,41,Price not found
10.1 Inch Windows 10 Tablet 2-in-1 Touchscreen Mini Laptop with Detachable Keyboard/IPS 1280x800 /4GB RAM /32GB ROM/Dual Webcam/Bluetooth 4.2/WiFi/HDMI/Micro SD,3.3 out of 5 stars,40,219.99
Kids Tablet 7 Inch Quad Core Kids Learning Tablet Android 10 WiFi Bluetooth 2G 32G GMS Dual Camera for Home School Children Toddlers Parent Control Educational Apps Kid-Proof Case Great Gift,3.9 out of 5 stars,405,Price not found
Google Certified 10 Inch Android 10 OS Tablet by Azpen IPS 1280 x 800 HD Display 2GB RAM 32GB Storage Dual Camera Quad Core Bluetooth GPS,4.0 out of 5 stars,137,Price not found
"Huawei MediaPad M5 Lite Tablet with 10.1"" FHD Display, Octa Core, Quick Charge, Quad Harman Kardon-Tuned Speakers, WiFi Only, 3GB+32GB, M-Pen Lite Stylus Included, Space Gray (US Warranty)",4.4 out of 5 stars,263,227.32
"YESTEL 10.1 Inch Tablet 4G LTE SIM + 5G/2.4G Dual Band WiFi, Android 10 Tablets with Octa-Core 64GB ROM 3GB Fast RAM, Full HD Display, 6000mAh Battery, Dual Camera 5.0 + 8.0MP, Bluetooth, GPS - Gray",4.4 out of 5 stars,391,Price not found
7 Kids Tablet Android Tablet for Kids WiFi Toddler Tablet 1G+16GB Quad Core Kids Tablets with Bluetooth Camera Support Google Play Store Netflix YouTube Parental Control Kids Learning Tablet (Pink),3.7 out of 5 stars,673,Price not found
Tablet for Kids 7 Kids Tablet for Toddlers 1GB 16GB Android 9.0 Toddler Tablets with Case Included WiFi Camera HD Screen Google Play Store YouTube Parental Control (Pink),4.2 out of 5 stars,160,Price not found
"10.1"" Inch Android Tablet PC,3G Unlocked Phablet 4GB RAM 64GB Storage with Dual sim Card Slots and Cameras, Tablet PC with WiFi, Bluetooth,GPS(White)",3.5 out of 5 stars,"1,092",Price not found
"Kids Tablet for Learning, Android 8.1 Tablet for Kids, 7 inch 1024x600 HD IPS Screen, 1GB RAM+16GB ROM, with WiFi, Bluetooth, Dual Camera, Parental Control & 1.8GHz Quad-core Processor-Blue",3.7 out of 5 stars,7,Price not found
"TJD 7.5 Inch Android Tablet, 1440x1080 IPS Display, Android 10, 2GB RAM 32GB ROM, 2MP+5MP Dual Camera, Quad-Core Processor, Wi-Fi Bluetooth Google Certified 3500mAh Black Red",3.0 out of 5 stars,9,Price not found
"10 inch Android Tablet PC, 4GB RAM, 64GB ROM, Octa-Core Processor, IPS HD Display 1280×800, Dual Sim Card Slots, WiFi, GPS, Bluetooth (Silver)",2.0 out of 5 stars,2,Price not found
"Android Tablet 10 Inch, 3G Phablet Android 9.0 Pie, Dual SIM Card Slots and Cameras, GMS Certified, 32GB, Bluetooth, WiFi,GPS,Silver",3.9 out of 5 stars,"1,142",Price not found
"Tablet 10 Inch, Android 9.0 Pie Tablet with 32GB/128GB Expand, 3G Phone Tablets & Dual Sim Card & 2MP+ 5MP Dual Camera, Quad Core Processor, 1280x800 IPS HD Display, WiFi, Bluetooth, GPS, FM(Black)",3.8 out of 5 stars,10,Price not found
"ZONKO 10 Inch Android Tablet, 3G Phone Call Tablet with 2 sim Card Slots, Included Bluetooth Keyboard, Wireless Mouse, Stylus, Quad-Core Processor, 2GB RAM 32 GB ROM 128GB Extended Memory, WiFi, GPS",3.9 out of 5 stars,52,Price not found
"Kids Tablet PC, Veidoo 10.1"" Android Tablet PC, 1280 x 800 HD IPS Screen, 1GB Memory, 16GB Storage, Premium Parent Control Pre-Installed Educational APP, Tablet PC for Student (Blue)",4.0 out of 5 stars,215,Price not found
"GPD XD Plus [Official distributor,Latest HW & Most Stable Update] Foldable Handheld Game Consoles 5"" Touchscreen, Android 7.0 Fast Mediatek MT8176 Hexa-core 2.1GHz CPU, 4GB RAM/32GB ROM",4.3 out of 5 stars,271,Price not found
"Android Tablet 10 Inch, Google Android 8.0 Unlocked Tablet PC with Dual SIM Card Slots, 3G Phone Support, Octa Core Processor, 64GB, 2MP+8MP Dual Camera, WiFi, Bluetooth, GPS (Silver)",3.6 out of 5 stars,44,Price not found
"8"" Windows 10 Ultra Slim Windows Tablet - 2GB RAM 64GB Storage, 1280x800 IPS HD Display, 4,000mAh Battery, 8 inch, Black",3.3 out of 5 stars,21,Price not found
"Fusion5 10.1"" 2in1 Google Certified Android Laptop Tablet PC - (Powerful Processor, Android 10 Q, 3GB RAM, 32GB Storage, Dual Cameras, HD IPS, Type C, Bluetooth Tablet PC with Docking Keyboard)",4.2 out of 5 stars,236,169.99
"Used sur face pro 3 Tablet 95% New 12 Inches Touchscreen 4th Gen Intel Core i5-4300U 4 GB RAM 128 GB SSD with Type Cover Keyboard and Windows 10, Include Charger",0,0,Price not found
"Pritom TronPad P7 PRO 7'' Tablet - Android 9.0 Pie Tablet with 2GB RAM, 32 GB Storage, Quad Core Processor, HD IPS Display, Dual Camera, Bluetooth, WiFi Tablet PC with case, Black",4.0 out of 5 stars,48,Price not found
"Android Tablet 10 Inch, 5G WiFi Tablet, 1GB RAM, 16GB ROM, Quad-Core Processor,800x1280 Touch Screen Full HD Display, Bluetooth, GPS, OTG – Silver",4.1 out of 5 stars,47,Price not found
"VANKYO MatrixPad P40 Tablet 10.1"", Octa-Core 2GHz Processor, Android 10 Tablets, 1080P Full HD IPS Display, 64 GB Storage, 3 GB RAM, 13MP+5MP Dual Camera, Micro HDMI, 5G Wi-Fi, GPS, Space Gray",0,0,Price not found
"CHUWI UBook X 12'' Touchscreen Windows 10 Tablet PC, Intel N4120 Quad Core Processor, 2K Display, 8GB RAM/256GB SSD with Type-c, USB 3.0 (Keyboard and Pen not Included)",4.1 out of 5 stars,39,Price not found
"Dragon Touch Notepad Y80 8 inch Tablet, 2GB RAM 32GB Storage, Android 9.0 Pie Android Tablet, Quad-Core, 8"" IPS HD Display, 8MP Rear Camera, WiFi Only, Black",3.5 out of 5 stars,35,Price not found
"Samsung Galaxy T290 Tab A 8-Inch 32 GB WiFi Android 9.0 Touchscreen Tablet Silver (2019) International Version Bundle - Case, Screen Protector, Stylus, 32GB microSD Card & Mobile Deals Cleaning Cloth",4.6 out of 5 stars,303,Price not found
"Tablet 10 Inch 3G Phone Tablets with 32GB Storage Dual Sim Card Tablet PC with Silicone Case, WiFi, Bluetooth, 5MP Camera, GPS, Quad Core, HD Touchscreen, Support 3G Phone Call (Black)",3.6 out of 5 stars,9,Price not found
"7 inch Android 10.0 Tablet qunyiCO Y7, 2GB RAM 32GB Storage, Dual Camera Quad-Core 1024 x 600 IPS HD Display Screen Bluetooth Wi-Fi Only, Google GMS Certified 3000mAh",3.7 out of 5 stars,145,Price not found
"Android Tablet 10 inch, Octa Core Processor, 5G & 2.4G WiFi Tablets with 32GB Storage, 5MP+13MP Dual Cameras & Micro SD, 1280×800 IPS HD Display, Bluetooth, USB Type-C, Google Play, Gray",5.0 out of 5 stars,1,Price not found
"Tablet 10 inch Android, 3G Unlocked Phablet, 2GB RAM 32GB Storage Dual Sim Cards, Google Certified, Quad Core Processor, IPS HD Screen, WiFi, Bluetooth, GPS - Black",3.8 out of 5 stars,399,Price not found
"Alcatel 1T 7.0"" 9013A (16GB, WiFi + Cellular) Face Unlock, Android 10, GPS, Tablet + Phone US 4G Volte GSM Unlocked (T-Mobile, AT&T, Metro PCS, Straight Talk) (Prime Black)",4.0 out of 5 stars,63,Price not found
"HP Elite X2 G4 13-Inch Tablet Computer and Docking Station Bundle (i5-8265U, 512GB SSD, 8GB RAM) Windows 10",5.0 out of 5 stars,1,Price not found
"Samsung Galaxy Tab A7 10.4"" WiFi + Cellular 32GB 4G LTE Tablet & Phone GSM Unlocked International Model w/US Charging Cube + 128GB MicroSD Card",4.6 out of 5 stars,181,Price not found
"Samsung Electronics Galaxy Tab S5e 10.5"", 64GB, Silver (LTE Verizon + WiFi) - SM-T727VZSAVZW",4.5 out of 5 stars,43,488.99
Kids Tablet 7in Toddler Tablet for Kids Android 10 Childrens' Tablet for Toddlers with WiFi Camera 2GB + 32GB Parent Control Google Play Store YouTube Netflix Parental Control Mode（Rose red）,3.9 out of 5 stars,179,Price not found
